{
  "width": 336,
  "height": 105,
  "styles": {
    "solid": {"light": "#000000", "dark": "#ffffff"},
    "ghost": {"light": "#000000", "dark": "#ffffff"}
  },
  "elements": [
    {
      "type": "path",
      "id": "r",
      "d": "M66 0H214V276H284L402 0H565L427 300C505 333 555 413 555 508C555 644 455 730 300 730H66ZM214 406V600H300C366 600 405 563 405 501C405 441 366 406 300 406Z",
      "fill": "$solid",
      "transform": {"translate": [0.0, 103.6], "scale": [0.056, -0.14]}
    },
    {
      "type": "path",
      "id": "e1",
      "d": "M80 0H530V130H227V312H495V436H227V600H530V730H80Z",
      "fill": "$ghost",
      "opacity": 0.05,
      "transform": {"translate": [33.6, 103.6], "scale": [0.056, -0.14]}
    },
    {
      "type": "path",
      "id": "l1",
      "d": "M115 0H560V135H265V730H115Z",
      "fill": "$solid",
      "transform": {"translate": [67.2, 103.6], "scale": [0.056, -0.14]}
    },
    {
      "type": "path",
      "id": "e2",
      "d": "M80 0H530V130H227V312H495V436H227V600H530V730H80Z",
      "fill": "$ghost",
      "opacity": 0.05,
      "transform": {"translate": [100.8, 103.6], "scale": [0.056, -0.14]}
    },
    {
      "type": "path",
      "id": "a1",
      "d": "M25 0H178L213 165H387L422 0H575L394 730H204ZM238 285 275 462C285 512 295 567 300 595C305 567 316 512 326 461L361 285Z",
      "fill": "$ghost",
      "opacity": 0.05,
      "transform": {"translate": [134.4, 103.6], "scale": [0.056, -0.14]}
    },
    {
      "type": "path",
      "id": "s",
      "d": "M302 -10C456 -10 553 75 553 206C553 324 481 415 366 441L274 462C230 472 205 496 205 535C205 582 239 612 296 612C355 612 390 581 390 531H536C536 659 443 740 296 740C149 740 59 660 59 530C59 423 131 342 246 315L335 294C382 283 406 247 406 206C406 154 367 120 302 120C235 120 193 155 193 210H47C47 75 148 -10 302 -10Z",
      "fill": "$solid",
      "transform": {"translate": [168.0, 103.6], "scale": [0.056, -0.14]}
    },
    {
      "type": "path",
      "id": "a2",
      "d": "M25 0H178L213 165H387L422 0H575L394 730H204ZM238 285 275 462C285 512 295 567 300 595C305 567 316 512 326 461L361 285Z",
      "fill": "$ghost",
      "opacity": 0.05,
      "transform": {"translate": [201.6, 103.6], "scale": [0.056, -0.14]}
    },
    {
      "type": "path",
      "id": "b",
      "d": "M66 0H310C460 0 561 84 561 211C561 304 504 378 422 387V389C494 399 544 459 544 542C544 655 447 730 301 730H66ZM211 436V609H299C357 609 393 577 393 523C393 469 357 436 299 436ZM211 121V318H305C370 318 410 280 410 219C410 158 370 121 305 121Z",
      "fill": "$solid",
      "transform": {"translate": [235.2, 103.6], "scale": [0.056, -0.14]}
    },
    {
      "type": "path",
      "id": "l2",
      "d": "M115 0H560V135H265V730H115Z",
      "fill": "$solid",
      "transform": {"translate": [268.8, 103.6], "scale": [0.056, -0.14]}
    },
    {
      "type": "path",
      "id": "e3",
      "d": "M80 0H530V130H227V312H495V436H227V600H530V730H80Z",
      "fill": "$ghost",
      "opacity": 0.05,
      "transform": {"translate": [302.4, 103.6], "scale": [0.056, -0.14]}
    }
  ]
}
